create database mydb2  character set utf8;
use mydb2;
			
create table student(
id int,
name varchar(20),
chinese int,
english int,
math int
);

insert into student(id,name,chinese,english,math) values(1,'何东',80,85,90);
insert into student(id,name,chinese,english,math) values(2,'权筝',90,95,95);
insert into student(id,name,chinese,english,math) values(3,'何南',80,96,96);
insert into student(id,name,chinese,english,math) values(4,'叶坦',81,97,85);
insert into student(id,name,chinese,english,math) values(5,'何西',85,84,90);
insert into student(id,name,chinese,english,math) values(6,'丁香',92,85,87);
insert into student(id,name,chinese,english,math) values(7,'何北',75,81,80);
insert into student(id,name,chinese,english,math) values(8,'唐娇',77,80,79);
insert into student(id,name,chinese,english,math) values(9,'任知了',95,85,85);
insert into student(id,name,chinese,english,math) values(10,'王越',94,85,84);

===select 别名 排序都能用
select chinese+english+math   总分 from student 
order by 总分;
		
		select (chinese+english+math )  总分,  avg(chinese+english+math ) avgf from student 
		order by 1;


		order by 总分' at line 1
		mysql> select (chinese+english+math )  totalscore,  avg(chinese+english+math ) avgf from student 
		    -> order by 1;
		+--------+----------+
		| 总分   | avgf     |
		+--------+----------+
		|    255 | 259.3000 |
		+--------+----------+
		1 row in set (0.00 sec)
		
===学生表分组练习 
	alter table student add  column clssid int;
	update student set clssid = 1 where id>=1 and id<=5; 
	
	update student set clssid = 2 where id between 6 and 10 
	
===>求各个班级的总分的平均分
====oracle和mysql的分组区别测试 
		select   clssid 班级编号, avg(chinese+english+math ) 班级平均分
		from student
		group by clssid
		
		
		======>
		
		select a, b, c, e
		from table1
		group by  a, b ,c ,d 

======>错误案例
		select  name, clssid 班级编号, avg(chinese+english+math ) 班级平均分
		from student
		group by clssid


		mysql> select  name, clssid 班级编号, avg(chinese+english+math ) 班级平均分
		    -> from student
		    -> group by clssid;
		+--------+--------------+-----------------+
		| name   | 班级编号     | 班级平均分      |
		+--------+--------------+-----------------+
		| 何东   |            1 |        265.8000 |
		| 丁香   |            2 |        252.8000 |
		+--------+--------------+-----------------+
		2 rows in set (0.00 sec)
		
		






、、、、、、、、、、、、、、、、、、、、、、、、、、、、、、、、、、、
select d.deptno,d.dname,count(e.empno)
from dept d,emp e
where d.deptno=e.deptno
group by d.deptno,d.dname;